,column1
36,பந்தலின் மறுபக்கத்தில் கார்மிகர்கள் வரும் பாதை. அதன் வழியாக மூங்கில்களில் தொங்கிய கூடைகளில் மலர்களும் இலைகளும் நெய்யும் தூபங்களும் வந்துகொண்டிருந்தன. அரசகுலத்தவர் வரும் பாதை எதிரே இருந்தது. வலப்பக்கம் வாழைப்பூ போல செந்நிற மரவுரியாடை அணிந்த முனிவர்கள். இடப்பக்கம் சங்குக்குவியல்கள் போல வெண்ணிற ஆடையணிந்த வைதிகர்கள். நடுவே சென்று மேலும் இரண்டாகப் பிரிந்த பந்தல்களில் ஒருபக்கம் செந்நிற தலைப்பாகைகள் அணிந்த ஷத்ரியர். மறுபக்கம் பொன்னிறத் தலைப்பாகைகள் அணிந்த வைசியர். அப்பால் நீலநிறத்தலைப்பாகை அணிந்த சூத்திரர். ஒவ்வொரு பகுதியிலும் பெண்களுக்கான இடம் தனியாக பகுக்கப்பட்டிருந்தது.
37,வேள்வியதிபரான வைசம்பாயனர் வேள்விக்குளத்தின் வலப்பக்கம் மணைமேல் விரிக்கப்பட்ட தர்ப்பைப்பரப்பு மேல் அமர்ந்திருந்தார். ஆஸ்திகன் அருகே சென்று அவரை வணங்கினான். தன் குலத்தையும் தந்தையின் பெயரையும் சொன்னபின்பு முனிவர்களின் இடத்துக்குச் சென்று அமர்ந்துகொண்டான். நாற்பதுநாட்களுக்கு முன்பு அரணிக்கட்டையைக் கடைந்து உருவாக்கப்பட்ட நெருப்பு வேள்விக்குளத்தில் ஹோதாக்களால் ஒவ்வொரு கணமும் ஊட்டப்பட்டு பொன்னிறத்தில் எழுந்தாடிக்கொண்டிருந்தது.
38,"வெளியே மங்கல வாத்தியங்கள் முழங்கின. பல்லியமும் கொம்பும் பெருமுழவும் மணியும் சேர்ந்து கலந்த ஒலியுடன் வேதபண்டிதர்களின் வேதகோஷம் இணைந்து ஒலித்தது. முதலில் கட்டியம் சொல்லும் கோல்காரன் உள்ளே வந்தான். கையில் பெரிய பொன்னாலான தலைக்கோலை வைத்திருந்தான். மிடுக்குடன் உள்ளே வந்து அவைமேடை மேல் ஏறி நின்று தலைக்கோலை மேலே தூக்கி உரக்கக் கூவினான் “ஜெயவிஜயீபவ! அஸ்தினபுரத்தை ஆளும் வேந்தர், அத்திரி முனிவரின் கொடிவழிவந்தவர், குருகுலத்தோன்றல் பரீட்சித் மாமன்னரின் புதல்வர், மண்ணுக்கும் விண்ணுக்கும் இனியவர், பாரதவர்ஷத்தின் தலைவர் ஜனமேஜய மகாசக்ரவர்த்தி எழுந்தருள்கிறார்!”"
39,"மங்கலவாத்தியக்குழு முதலில் உள்ளே வந்தது. அதைத்தொடர்ந்து பூரண கும்பம் ஏந்திய வைதிகர் நீர்தெளித்துக்கொண்டு வந்தனர். பின்னர் காவல் வீரர்கள் கவச உடை அணிந்து ஆயுதங்களுடன் வந்தனர். தம்பியரான சுதசேனரும் உக்ரசேனரும் பீமசேனரும் உருவிய வாட்களுடன் சூழ்ந்து வர, முன்னால் புரோகிதர்கள் வேதகோஷமிட்டு அட்சதை வீசி வாழ்த்த, அரங்கிலிருந்த முனிவர்கள் மலர்வீசி ஆசியளிக்க, ஆரங்களிலும் காதுகளின் குண்டலங்களிலும் புஜகீர்த்திகளிலும் கங்கணங்களிலும் கச்சைமணியிலும் செம்மணிகள் சுடர்விட அக்னிதேவன் எழுந்தருளியது போல் ஜனமேஜய சக்ரவர்த்தி பட்டத்தரசி வபுஷ்டையுடன் உள்ளே வந்தார்."
40,பகுதி ஒன்று : வேள்விமுகம்
41,குருவம்சத்தின் ஐம்பத்திரண்டாவது தலைமுறையைச்சேர்ந்த ஜனமேஜயன் தன் பதின்மூன்றாவது வயதில் மன்னனானபோது அவன் வெல்வதற்கு நாடுகள் ஏதும் இருக்கவில்லை. அவன் தீர்ப்பதற்குரிய சிக்கல்களேதும் எஞ்சவில்லை. அவன் சித்தமோ எரிதழல் காற்றை உணர்வதுபோல காலத்தை ஒவ்வொரு கணமும் அறிந்துகொண்டிருந்தது. ஆகவே அவன் பகடையாட்டத்தில் ஈடுபாடுகொண்டவனாக ஆனான். ஏணியும் பாம்பும் கொண்ட வரைபடத்தின் கட்டங்களில் மானுடவாழ்க்கையின் அனைத்து விசித்திரங்களும் உறைந்திருப்பதை சிறிது சிறிதாக அவன் காண ஆரம்பித்தான். ஒரு பகடையை புரளவைத்து பன்னிரண்டாகவோ சுழியாகவோ ஆகச்செய்யும் விசையின் மர்மங்களே அவன் சிந்தனையை நிறைத்திருந்தன. இரவில் மென்மையான துவர்ப்பும் கசப்பும் கலந்த இனிய மதுவின் போதையில் தூங்கும்போதுகூட அவன் பகடைகளை மனதுக்குள் உருட்டிக்கொண்டிருந்தான். கனவுக்குள் ஏணிகளில் ஏறி பாம்புகளால் கவ்வப்பட்டு சரிந்து மீண்டுவந்தான்.
42,"ஆட்டத்தின் தருணத்தில் ஒருநாள் சேவகன் வந்து உஜ்ஜாலகத்தில் வசிக்கும் தவமுனிவரான உத்தங்கர் வந்திருப்பதாக சேதி சொன்னபோது அவரை விருந்தினருக்கான ஆசிரமத்தில் தங்கவைத்து வேண்டிய காணிக்கைகளைக் கொடுத்து அனுப்பும்படி திரும்பிப்பாராமலேயே ஆணையிட்டான். சேவகன் சென்ற சற்றுநேரத்தில் மரவுரியணிந்த கரிய உடலும், நீண்ட தாடியும் சடைக்கற்றைமுடிகளுமாக உத்தங்கர் வந்து அவன் முன் நின்றார். உரக்கச்சிரித்தபடி ‘பகடை ஆடுகிறாயா? ஆடு ஆடு….உன் குலத்தை ஒருநாளும் நாகத்தின் நாக்கு விட்டுவிடப்போவதில்லை…உன் தந்தையைக் கடித்த நாகம்தான் அந்த ஆடுகளத்திலும் இருக்கிறது’ என்றார்."
43,"அதிர்ச்சியுடன் எழுந்து “என்ன சொன்னீர்கள்? என் தந்தையை நாகம் கடித்ததா?’ என்றான் ஜனமேஜயன். உத்தங்கர் உரக்கச்சிரித்து ‘நினைத்தேன். ஒவ்வொரு கணமும் நிகழும் விதியின் ஆட்டத்தைப்பற்றிய முழுமையான அறியாமை கொண்டவர் அல்லாமல் பிறர் இந்த போலி ஆடுகளத்தின் முன் குனிந்து அமரமுடியாது’ என்றார். ‘ஆடு ,ஆடு, உன்னைத்தேடி உனக்கான விஷம் வந்துசேரும்’ என்றபின் திரும்பிச்சென்றார். ‘மாமுனிவரே….என்ன சொல்கிறீர்கள்?’ என்றபடி ஜனமேஜயன் அவர் பின்னால் சென்றான். ஆனால் அவர் வேகமாக திரும்பிச்சென்று அரண்மனையைவிட்டு நீங்கிவிட்டார்."
44,"அன்றிரவெல்லாம் தூக்கமின்றி தவித்தபடி அவன் தன் தந்தையைப்பற்றியே எண்ணிக்கொண்டிருந்தான். குளிர்கால இரவொன்றில் படுக்கையில் தூங்கிக்கொண்டிருந்த அவனை குனிந்து நோக்கி கால்களை முத்தமிட்டபின்னர் அன்னையின் குழலை வருடிவிட்டு விடைபெற்றுச்சென்ற பரீட்சித்தின் கண்களில் இருந்த அச்சத்தையும் தவிப்பையும் கண்முன் எழுதி தொங்கவிடப்பட்ட ஓவியத்திரைச்சீலை என அவன் கண்டான். மறுநாள் காலை கருக்கிருட்டில் ரதத்தில் ஏறி, வாசனையாக மட்டுமே புழுதி தெரிந்த தெருக்களின் வழியாகச் சென்று, புறநகர் குறுங்காட்டைத் தாண்டி,உத்தங்கரின் வனக்குடிலை அடைந்தான். இரவெல்லாம் நீண்ட யோகசாதனைக்குப்பின்பு நீராடி சடைமுடியை இளவெயிலில் உலர்த்திக்கொண்டிருந்த அவரது மண்படிந்த மெலிந்த கரிய காலடிகளில் விழுந்து தன் அறியாமையை போக்கும்படி கோரினான். சாலமரம் நிழல்விரித்து நின்ற தடாகத்தின் கரையில் அவனை அமரச்செய்து உத்தங்கர் அந்தக்கதையைச் சொன்னார்."
45,"குருவம்ச மாவீரன் அர்ஜுனனின் மைந்தன் அபிமன்யு தன் பதினாறாவது வயதில் குருஷேத்ரப் போர்க்களத்தில் மடிந்தான். அவன் மனைவி உத்தரைக்கு அப்போது பதினாறு வயது. அரண்மனைக்கு அப்பால் என்ன நடக்கிறதென்பதே அறியாத பேதைப்பெண்ணாக இருந்தாள். ஒவ்வொருநாளும் இறப்புச்செய்திகள் வருவதைக்கொண்டுதான் அவள் குருஷேத்ரப்போரையே அறிந்தாள். அவள் இரவுகள் தோறும் அஞ்சிக்கொண்டிருந்த செய்தி ஒருநாள் வந்தது. அவள் சிலநாட்கள் மட்டுமே அறிந்திருந்த இளம்கணவன், இன்னமும் முழுமையாக அவள் பார்த்திராத முகத்தைக்கொண்ட சிறுவன், மீளமுடியாத படைவளையத்தில் சிக்கி களத்தில் உயிரிழந்தான்"
46,செய்திகேட்டு மயங்கி விழுந்த அவளுடைய நாடியைப்பிடித்து சோதனைசெய்த அரண்மனை மருத்துவச்சிதான் அவள் கருவுற்றிருப்பதைச் சொன்னாள். கண்விழித்தெழுந்து உடன்கட்டை ஏறவிரும்பி கதறிய அவளை மூத்தவர்கள் கட்டுப்படுத்தினர். குருவம்சத்தின் விதை வயிற்றில் வளர்கையில் அவள் சிதையேறுவது நூல்நெறியல்ல என்றனர். விதவைகள் நிறைந்த அந்தப்புரத்தின் குளிர்ந்த அமைதியில் தன்னை பூமியுடன் பிணைக்கும் வயிற்றை தொட்டுத்தொட்டு சபித்தபடி அவள் ஒவ்வொரு நாளாக வாழ்ந்தாள். நாற்பத்தோராம் நாள் அவளை நதிக்கரைக்கு கொண்டுசென்று வண்ண ஆடைகளையும் அணிகளையும் கூந்தலையும் நீக்கி விதவைக்கோலம் கொள்ளச்செய்தனர். அங்கிருந்து மருத்துவச்சிகள் சூழ்ந்த அரண்மனை உள்ளறையின் ஆழத்துக்கு அவள் சென்றாள்.
47,"அதன்பின் அவள் அதுவரையிலான வாழ்க்கையை முற்றிலும் மறக்க முயன்றுகொண்டிருந்தாள். உத்தரநாட்டின் பனிபடிந்த இமயமுகடுகள் வெண்பந்தலாகத் தெரியும் வடதிசையையும், பூவனம் நோக்கி திறக்கும் சாளரங்கள் கொண்ட அரண்மனையில் கழித்த தன் இளமைப்பருவத்தையும், அங்கிருந்து வெம்மை தகிக்கும் சமவெளியையும் அசைவில்லாததுபோலத் தோன்றும் நீலநதிகளையும் கொண்ட இந்த தேசத்துக்கு வந்ததையும், விளையாட்டுத்தோழனாகிய கணவனை அடைந்ததையும் எல்லாம் பிரக்ஞையால் தேய்த்து தேய்த்து அழிக்கப்பார்த்தாள். சிந்தை தீப்பற்றி எரியும்போது அவளுடைய உடல் நடுநடுங்கி கைவிரல்களெல்லாம் முறுக்கிக்கொள்ளும். பற்கள் கிட்டித்து உதடுகள் கடிபடும். அப்போது அவளுடன் உத்தரதேசத்தில் இருந்து வந்த செவிலி அவள் நாசியில் மயக்கத்தூபத்தைக் காட்டி தூங்கவைத்தாள்."
48,"வெளிறி மெலிந்து, கன்னங்கள் வறண்டு, வாய் புண்ணாகி, கண்கள் குழிந்து, புதைகுழியிலிருந்து தோண்டி எடுக்கப்பட்ட சடலம் போலிருந்த உத்தரை ஆறுமாதத்திலேயே குழந்தையைப் பெற்றெடுத்தாள். அக்குழந்தை வெளிவந்த குருதியேகூட செந்நிறமிழந்து மஞ்சளாக இருந்தது என்றனர் மருத்துவச்சிகள். குளிர்ந்த கரங்களுடன் நடுங்கும் உதடுகளன்றி உயிரசைவே இல்லாமல் கிடந்த அவளைப்போலவே குழந்தையும் அசைவில்லாமல் கண்மூடிக் கிடந்தது. மருத்துவச்சி அதை மெல்லத்தூக்கி அது உயிருடனிருக்கிறதா என்று பார்த்தாள். அதன் உடலுக்குள் எங்கோ மெல்லிய இதயத்துடிப்பை உணர்ந்தது உண்மையா தன் கற்பனையா என அவள் ஐயம் கொண்டாள்."
49,குருகுலத்தின் அத்தனை வழித்தோன்றல்களும் குருஷேத்ரக் களத்தில் இறந்தபின் எஞ்சிய ஒரே ஒரு குழந்தை என்பதனால் அதன் வருகையை நாடே எதிர்பார்த்திருந்தது. மாமன்னர் யுதிஷ்டிரர் அஸ்வமேத வேள்வி ஒன்றை தொடங்கவிருந்த நேரம். ஐம்பத்தாறுநாட்டு மன்னர்களும் அரண்மனை வளாகத்தில் வந்து தங்கியிருந்தனர். செய்திகேட்டு யுதிஷ்டிரர் சோர்ந்து முகம்பொத்தி அரியணையில் சரிந்துவிட்டார். அரண்மனையெங்கும் அழுகுரல்கள் ஒலிக்க ஆரம்பித்தன. வீரகுடி வழக்கப்படி குழந்தையை வாளால் போழ்ந்து வடதிசை மயானத்தில் அடக்கம் செய்யவேண்டுமென்று நிமித்திகர் சொன்னார்கள். பட்டத்தரசி திரௌபதி கண்ணீர் மார்பில் சொட்ட ஓடிச்சென்று நதிக்கரை அரண்மனையில் தங்கியிருந்த யாதவமன்னன் கிருஷ்ணனின் முன்னால் நின்றாள். ஞானியான அவனே தன் குலத்தை அழியாமல் காப்பாற்றவேண்டுமெனக் கோரினாள்.
50,"ஈற்றறைக்கு வந்து குழந்தையைக் கண்டதுமே கிருஷ்ணன் புரிந்துகொண்டான். அதன் அன்னையின் துயரமெல்லாம் தேங்கிய சிமிழ் போலிருந்தது குழந்தை. இக்கணமே இதை இதன் அன்னையிடமிருந்து பிரிக்கவேண்டும், ஒரு துளி தாய்ப்பால்கூட இது அருந்தக்கூடாது என கிருஷ்ணன் சொன்னான். யாதவகுலமருத்துவர்கள் பிரம்மாண்டமான கடற்சிப்பி ஒன்றைத் திறந்து அந்த உயிருள்ள மாமிசத்தின் வெம்மைக்குள் குழந்தையை வைத்து மூடி எடுத்துக்கொண்டு துவாரகைக்கு கொண்டுசென்றார்கள். துவாரகையில் மேலும் நான்குமாதம் உயிருள்ள சிப்பிக்குள் இருந்து அது வளர்ந்தது. அக்குழந்தைதான் உன் தந்தை பரீட்சித் என்றார் உத்தங்கர்."
51,"உன் பாட்டி உத்தரை அதன்பின் உயிர்தரிக்கவில்லை. தன் உடல் நீங்கி வெளியே வந்துகிடந்த குழந்தையை உடைந்த கட்டியிலிருந்து வெளிவந்த சீழைப் பார்க்கும் நிம்மதியுடன் பார்த்தபின் கண்களை மூடி மெல்ல விலகிப்படுத்துக்கொண்டாள். தன்னிலை மீளாமலேயே நான்காம் நாள் அவள் இறந்துபோனாள். சிப்பிகளுக்குள் வளர்ந்த சோதனையாலேயே அவனை அனைவரும் பரீட்சித் என்று அழைத்தனர். தாயின் இதயத்துடிப்புகள் கேளாமால், முலைச்சுவை அறியாமல் பரீட்சித் வளர்ந்தான். அவன் அறிந்ததெல்லாம் உப்பு சுவைக்கும் கடல்மணத்தை மட்டும்தான். எஞ்சிய வாழ்நாளெல்லாம் அவன் மண்ணில் கால்நிலைக்காதவனானான்."
