,column1
69,"‘அதைசெய்கிறேன் குருநாதரே’ என ஜனமேஜயன் தன் ஆசிரியரின் கால்களை பற்றிக்கொண்டான். ‘என் அரசு செல்வம் அனைத்தையும் அதன்பொருட்டு செலவிடுகிறேன். அதற்காகவே வாழ்கிறேன்….அதற்காக எதற்கும் சித்தமாக இருக்கிறேன்’ கண்ணீருடன் அவன் சொன்னான் “குருஷேத்ர மண்ணில் செத்து விழுந்த ஐந்துலட்சம் மனிதர்களிடம் நான் சொல்லவிரும்புகிறேன் குருநாதரே, எங்கள் மூதாதையர்களே நீங்கள் நிம்மதியாக உறங்குங்கள். இனிமேல் நாங்கள் போர் செய்ய மாட்டோம். இனிமேல் நாங்கள் சகமனிதனை வெறுக்க மாட்டோம். நீங்கள் உங்கள் உயிரைக்கொடுத்து கற்றுத்தந்த பாடத்தை நாங்கள் கற்றுக்கொண்டோம்… அப்படியொரு சொல்லை என்னால் சொல்லமுடிந்தால் நான் குருகுலத்தின் வாழ்க்கையை நிறைவுசெய்தவன் ஆவேன். களத்தில்பட்ட அத்தனை குருவம்சத்தினருக்கும் என் கடனைச் செய்தவனாவேன்”"
70,"ஜனமேஜயனின் ஆணைப்படி இருபதாண்டுகாலம் முயன்று வைசம்பாயனர் சர்ப்பசத்ர வேள்வியை ஒருங்கிணைத்தார். நான்குமாதங்கள் எட்டுத்திசைகளிலும் நடந்த உபவேள்விகள் வழியாக சமித்துகளை சேர்த்தார்.அதற்காக பாரதவர்ஷமெங்கணும் இருந்து முனிவர்களையும் வைதிகர்களையும் பண்டிதர்களையும் வரவழைத்தார். பாரதவர்ஷத்தின் ஐம்பத்தாறு தேசங்களிலிருந்தும் வேள்விநெருப்புக்குரிய ஆயிரத்தி எட்டு அவிப்பொருட்களை சேர்த்தார். பங்குனி மாதம் கிருஷ்ணபக்‌ஷம் முதல்நாளில் அரண்மனை அருகே எழுப்பப்பட்ட வேள்விக்கூடத்தில் மகாசர்ப்பசத்ர வேள்வி தொடங்கியது. முப்பத்துமுக்கோடி வானவரும், மும்மூர்த்திகளும், மூதாதையரும் அவியளித்து நிறைவுசெய்யப்பட்டனர். திசைத்தேவர்களும் விண்ணகமுனிவர்களும் வேதமூர்த்திகளும் மகிழ்விக்கப்பட்டனர். காவல்பூதங்களும் கானகதேவதைகளும் கனியச்செய்யப்பட்டனர். வேள்விமங்கலம் நிறைவடைந்தபின் நாற்பதுநாட்களுக்குப்பின்பு பூர்ணாகுதி நிகழவேண்டிய இறுதி நாள் அன்று.ஆடிமாதம் வளர்பிறை ஐந்தாம்நாள்."
71,பகுதி ஒன்று : வேள்விமுகம்
72,"சர்பசத்ரவேள்விப்பந்தலில் பெருமுரசம் தொலைதூர இடியோசை போல முழங்க, மணிமுடி சூடி உள்ளே நுழைந்தபோது ஜனமேஜயன் தன் இளமைக்கால நினைவொன்றில் அலைந்து கொண்டிருந்தார். அவரும் தம்பியர் உக்ரசேனனும் சுருதசேனனும் பீமனும் சிறுவர்களாக வனலீலைக்குச் சென்றபோது நடந்தது அது. யமுனைநதிக்கரையில் அவர்கள் சிறுவேட்டையாடியும் மரங்களிலாடியும் நீரில் துழாவியும் விளையாடினர். ஜனமேஜயன் தன் தம்பி சுருதசேனனிடம் வேள்விசெய்து விளையாடலாமெனச் சொன்னான். சத்ரியர்கள் செய்யவேண்டிய வேள்விச்சடங்குகள் அவர்களுக்கு அப்போதுதான் கற்பிக்கப்பட்டிருந்தன. நதிக்கரையில் கல்லடுக்கி வேள்விக்குளம் அமைத்து, சமித்துகள் பொறுக்கிச் சேர்த்து, அரணிக்கட்டை உரசி நெருப்பாக்கி அவர்கள் வேள்வியைத் தொடங்கினர். வேட்டையாடி கொண்டுவந்திருந்த மாமிசத்தையும் காட்டுமலர்களையும் காய்களின் நெய்யையும் ஆகுதியாக வைத்தனர்."
73,வேள்விக்குதிரை இல்லையே என்று சுருதசேனன் கேட்டான். காட்டிலிருந்து ஏதாவது ஒரு மிருகத்தை கொண்டுவா என்று ஜனமேஜயன் சொன்னான். தம்பியர் மூவரும் புதர்களை துழாவுகையில் குழிக்குள் கிடந்த ஒரு நாய்க்குட்டியைக் கண்டனர். எட்டு நாட்களுக்கு முன் காட்டுநாய் ஒன்று பெற்றிட்டது அந்தக்குட்டி. அதை அதன் அன்னை ஷிப்ரதேஜஸ் என அழைத்தது. வேட்டைக்குச் சென்ற அன்னை கொண்டுவரும் உணவுக்காக பசியுடன் காத்திருந்து சலித்து மெல்ல புதருக்குள் இருந்து வெளிவந்து அது முந்தையநாள் திறந்த புத்தம்புதிய கண்களால் உலகத்தைப்பார்த்தபோதுதான் அவர்கள் அதைக்கண்டடைந்தனர். அதை சுருதசேனன் தூக்கிக்கொண்டு வந்தான். அதையே வேள்விக்குதிரையாக உருவகித்து அதற்கு காட்டுக்கொடிகளால் சேணமும் கடிவாளமும் இட்டு வேள்வித்தூணில் கட்டினர். அதர்வவேத மந்திரங்களை முழக்கி வேள்வியைத் தொடங்கினர்.
74,"பசித்த நாய்க்குட்டி நான்குகால்களையும் ஊன்றி திமிறி கழுத்தை கட்டில் இருந்து உருவி ஓடிவந்து தன் இயற்கையால் மாமிச வாசனையை வாங்கிக்கொண்டு சிறியவாலை ஆனந்தமாகச் சுழற்றியபடி வேள்விப்பொருளாக வைக்கப்பட்டிருந்த மானிறைச்சியை நக்கி உண்ண ஆரம்பித்தது. திரும்பி அதைப்பார்த்த ஜனமேஜயன் தன் கையிலிருந்த தர்ப்பையால் அதன் முகத்தில் ஓங்கியறைந்தான். தர்ப்பை முட்கள் கண்ணில் குத்த நாய்க்குட்டி விழிகளை இழந்து ஓலமிட்டழுதபடி செடிகளில் முட்டியும், கற்களில் தடுக்கியும், கொடிகளில் சிக்கியும் காட்டுக்குள் ஓடியது. அந்த ஓலம் விண்ணகத்தில் இருக்கும் நாய்களின் தெய்வமாகிய சரமையின் செவிகளில் விழுந்தது. அந்தச்சிறுநாயில் குடிகொண்டு எழுந்து, பொன்னிற உடலும், நீண்ட வாலும், அர்க்யமிடக் குவிந்த கரங்கள் போன்ற செவிகளுமாக ஜனமேஜயன் முன்னால் சரமை வந்து நின்றது."
75,“ஒவ்வொரு உயிருக்கும் அதற்கான மனமும் உடலும் படைப்புசக்தியால் அளிக்கப்பட்டிருக்கின்றன. அவை ஒவ்வொன்றையும் உணர்ந்து அவையனைத்தும் தங்களுக்கு உகந்தபடி வாழ்வதற்கு வழிசெய்வதே மன்னனின் கடமை. நக்குவது நாயின் இச்சையாகவும் தர்மமாகவும் உள்ளது. அதைச்செய்தமைக்காக நீ அதன் மெல்லிய சிறுகழுத்தையும் மலர்ச்செவிகளையும் வருடி ஆசியளித்திருக்கவேண்டும். உன் மனம் அதைக்கண்டு தாயின் கனிவை அடைந்திருக்கவேண்டும். ஆனால் நீ நெறிவழுவினாய்” என்றது சரமை. தவறை உணர்ந்த ஜனமேஜயன் எழுந்து கண்ணீருடன் கைகூப்பி நின்றான். “தவறுக்கான தண்டனையை நீ அனுபவித்தாகவேண்டும். இந்த விழியிழந்த நாய்போலவே நீ வாழ்நாள் முழுக்க இருப்பாய்” என்று சொல்லி சரமை மறைந்தது.
76,கண்ணிழந்த நாயின் பதைப்பை அதன்பின் தன்னுள் என்றும் உணர்ந்துகொண்டே இருந்தார் ஜனமேஜயன். தெரியாதவற்றிலும் அறியாதவற்றிலும் முட்டி மோதிச் சரிவதையே தன் வாழ்க்கையாகக் கொண்டிருந்தார். புரியாதவை எல்லாம் அகத்தில் எத்தனை பெரிதாகின்றன என்று அவர் அறிந்தார். தன்னை அறிந்துகொள்ளமுடியாதவனின் தனிமையை தெய்வங்களும் நீக்கமுடியாதென்று உணர்ந்தார். அந்த இறுதிநாளில் வேள்விக்கூடத்தினுள் நுழைந்தபோது அங்கிருந்த நூற்றுக்கணக்கான பந்தற்கால்களில் அவருடைய பிரக்ஞை நிலையழிந்து முட்டிமுட்டி தத்தளித்தது.
77,வேள்விச்சாலைக்குள் புகுந்த மாமன்னனையும் பட்டத்தரசியையும் வைசம்பாயனர் அழைத்துச்சென்று செம்மணிக்கண்கள் விழித்த பொற்சிம்மங்கள் வாய்திறந்து நின்ற ஆசனத்தில் அமரச்செய்தார். யுதிஷ்டிரர் அமர்ந்த அரியணை என்பதனால் தர்மபதம் என்று அழைக்கப்பட்ட அது அறம் வழுவியவர்களை எரித்தழிப்பது என்றனர் சூதர்கள். குடிமக்களின் வாழ்த்தொலிகளும் வேதகோஷமும் கலந்து அருவியொலிபோல எழுந்தன. முனிவர்களின் மலர்களும் வைதிகரின் மங்கலஅரிசியும் அவர் மீது மழையெனப் பொழிந்தன.
78,"யக்ஞ எஜமானராகிய வைசம்பாயனர் கைகூப்பி “சக்கரவர்த்திக்கு வணக்கம். இன்று இந்த வேள்வியின் இறுதிநாள். இன்றும் தாங்களே வேள்விக் காவலனாக அமர்ந்து இதை முழுமைசெய்யவேண்டும்” என்று கேட்டுக்கொண்டார். ஜனமேஜயன் “அவ்வாறே ஆகட்டும்” என்றபடி கைகூப்பியபடி சிம்மாசனத்தில் அமர்ந்தார். அமைச்சர் ஒருவர் ஜனமேஜயன் கையில் பட்டில் சுற்றப்பட்ட நாரதசுருதியின் ஒரு ஏட்டுப்பிரதியை அளிக்க, தலைமை தளகர்த்தர் மணிகள் ஜொலித்த பொன் உறையுடன் கூடிய சிறிய உடைவாளை அளித்தார். நால்வருணத்து குடித்தலைவர் நால்வர் சேர்ந்து ஜனமேஜயனின் செங்கோலைக்கொண்டுவந்து அவரிடம் அளித்தனர். மேலே விரிந்த தாமரைமீது அமுதகலசச் சின்னம் கொண்ட பொற்செங்கோலை ஜனமேஜயன் வலக்கையில் ஏந்திக்கொண்டார்."
79,ஓவியம்: ஷண்முகவேல்
80,"வைசம்பாயனர் அவருக்கான பீடத்தில் அமர்ந்துகொண்டதும் முதன்மை ஹோதாவான சண்டபார்க்கவர் எழுந்து வணங்கி தர்ப்பையை அவர் கையில் கொடுத்து வேள்வியை முடிக்கும்படி கோரினார். கடலோரத் திராவிடச்சேர நாட்டிலிருந்து வந்திருந்த சண்டபார்க்கவர் பிருகுவின் மைந்தரான சியவன முனிவரின் குருகுலத்தைச் சேர்ந்தவர். நால்வகை வேதங்களில் அதர்வத்தை முதன்மையாக்கி, பூதயாகங்களை முதல்முறைமையாகக் கொண்டு, யோகானுஷ்டானங்கள் வழியாக பிரம்மத்தை அணுகும் சியவன முறை தென்மேற்குத் திராவிடத்திலும் வங்கத்திலும் மட்டுமே தழைத்திருந்தது. சண்டபார்க்கவர் தர்ப்பையை நாகவிரலில் கட்டுவதைக் கண்டதுமே ஆஸ்திகன் அவர் தான் கற்ற சியவன குருகுலத்தவர் என்பதைக் கண்டுகொண்டான்."
81,"முரசுகள் மீண்டும் முழங்கியதும் அதுவரை இருந்த ரித்விக்குகள் எழுந்து புதியவர்கள் அமர்ந்துகொண்டனர். அனைவரும் கரடித்தோலை போர்த்தியிருந்தனர். ஒவ்வொருவரின் பின்னாலும் உபஹோதாக்கள் அமர்ந்து சமித்துக்களை எடுத்துக்கொடுக்க அவர்கள் கடைசிகட்ட ஆகுதிகளை ஆரம்பித்தனர். எளியவையும் அரியவையுமான நீரும், இலைகளும், மலர்களும் முதல்கட்டத்தில் நெருப்புக்கு அளிக்கப்பட்டன. அரியவையும் இன்றியமையாதவையுமான நெய்யும், உணவும், ஆடைகளும் அதன்பின்னர் அவியாக பொழியப்பட்டன. அதன்பின் அரியவையும், அற்பமானவையும், மாமன்னர்கள் படைதிரட்டி ஒருவரையொருவர் கொன்றுகுவிக்கக் காரணமாக அமைந்தவையுமான நவமணிகள் அவியிடப்பட்டன. வேள்விச்சாலையில் ஒவ்வொருவர் கண்களும் அவற்றிலேயே பதிந்திருந்தன. கண்ணீர்த்துளிகள்போல, குருதித்திவலைகள் போல, விந்துச்சொட்டுகள் போல அவை நெருப்பில் விழுந்தபோது அரங்கெங்கும் நெடுமூச்சுகள் எழுந்தன."
82,"பூதயாகத்திற்கென நவத்துவாரங்களையும் மூடி முறைப்படி கொல்லப்பட்ட மானின் இறைச்சியும், பன்றியின் இறைச்சியும், பசுங்கன்றின் இறைச்சியும் அவியாக்கப்பட்டன. சத்வ, தமோ, ரஜோ குணம் கொண்ட அவை விண்ணாளும் தேவர்களுக்கு உணவாயின. பாதாளமூர்த்திகளுக்கு காகங்களும், நீர்த்தவளைகளும், தேரட்டைகளும், மீன்களும் அவியாக்கப்பட்டன. பறப்பவையும் தாவுபவையும் ஊர்பவையும் நீந்துபவையுமான அத்தெய்வங்களெல்லாம் அவிபெற்று பசியடங்கின. கடைசியாக சண்டபார்க்கவரும் அவருடன் வந்த பதினெட்டு ஹோதாக்களும் தம் வலக்கைகளைக் கிழித்து சொட்டிய குருதியை அவியாக்கினர்."
83,"யாகநெருப்பு பலாசவிறகையும் ஆலமர விழுதையும் உண்ணும் அதே பாவனையில் அவற்றை எல்லாம் உண்டு நின்றாடியதை ஆஸ்திகன் கண்டான். அதர்வ வேத சூக்தங்கள் வானிலிருந்து இழியும் அருவியின் ஓசையில், துதிக்கை தூக்கி பிளிறும் மதகரியின் குரலில், நிலத்தை அறைந்து கர்ஜிக்கும் சிம்மத்தின் ஒலியில் கேட்டுக்கொண்டிருந்தன. பின்பு வைசம்பாயனர் எழுந்து கை கூப்பினார் “இன்று சிராவண மாதம் சுக்லபஞ்சமி. இதோ வேள்விநெருப்புக்கு அன்னத்தை அவியாக அளிப்பது முழுமையாகி விட்டது வைதிகர்களே… ஐம்பூதங்களும் வேள்வியால் இப்போது தூய்மையாகிவிட்டன. நாம் நம் அகங்காரத்தின் அடையாளமாக நம்மிடமிருக்கும் அனைத்துப் பொருட்களையும் இந்தத் தழலுக்கு உணவாக்கி விட்டோம்…இனி நம் மனங்களில் உள்ள காமத்தையும் குரோதத்தையும் மோகத்தையும் இந்த நெருப்பிலே அவிஸாக்குவோம்!” என்றார்."
84,ரித்விக்குகளுடனும் ஹோதாக்களுடனும் இணைந்து அங்கிருந்த அனைவரும் தங்கள் நெஞ்சிலிருந்து எண்ணங்களை கையால் அள்ளி தீயில் போடுவது போல சைகை காட்ட அவற்றையெல்லாம் ஏற்றுக்கொண்டதுபோல தீ பின்வாங்கி கருகி பின்னர் மேலே எழுந்து படபடத்தது. ஆஸ்திகன் நெளியும் பல்லாயிரம் சர்ப்பங்களைப்போல அந்தக் கைகளை உணர்ந்தான். தன்னிலிருந்து தன்னை விலக்கும் கைகள் ஒரு கட்டத்தில் வெளியிலிருந்து தனக்குள் எதையோ அள்ளி நிரப்புபவையாகத் தோன்றின. அந்தச்சைகைகள் ஒருவகையான ஒத்திசைவை அடைந்த ஒரு கணத்தில் நீலத்தழல்பீடம் மீது ஏறிய செந்தழல் எழுந்து பறந்து கைநீட்டி வேள்விமண்டபத்தின் கூரைவிளிம்பைப் பற்றிக்கொண்டு மேலேறியது. வேள்விமண்டபத்தின் ஈச்சையோலைக்கூரை தீப்பற்றி செந்நெருப்புத்தழலாட எரியத்தொடங்கியது.
